Sourceid,Title,SJR,field,octile
5600153495,The Journal of Industrial Relations,0.486,14,5
5700154545,International Journal of Heritage Studies,0.448,14,5
5700185131,Journal of Management Education,0.484,14,5
6300153121,Journal of Theoretical and Applied Electronic Commerce Research,0.477,14,5
11400153332,Asia Pacific Journal of Human Resources,0.468,14,5
11600154157,TQM Journal,0.451,14,5
11700154369,Australian Journal of Management,0.497,14,5
11700154719,Gender in Management,0.412,14,5
12300154710,Economic and Labour Relations Review,0.393,14,5
14500154708,Statistical Journal of the IAOS,0.375,14,5
16400154731,School Leadership and Management,0.402,14,5
16400154732,International Journal of Leadership in Education,0.432,14,5
17400154830,Review of Managerial Science,0.479,14,5
17600155007,Career Development for Exceptional Individuals,0.417,14,5
17600155227,Asian Business and Management,0.378,14,5
17600155397,International Journal of Design,0.383,14,5
17700156766,Journal of Revenue and Pricing Management,0.416,14,5
18300156733,Foundations and Trends in Marketing,0.448,14,5
19600166406,European Business Organization Law Review,0.409,14,5
19700166619,"Journal of Neuroscience, Psychology, and Economics",0.479,14,5
19700175228,Management Research Review,0.396,14,5
19700181206,International Journal of Economic Research,0.408,14,5
19700187506,International Journal of Shipping and Transport Logistics,0.416,14,5
19700188331,Journal of Change Management,0.401,14,5
19700201414,Journal of Research in Interactive Marketing,0.484,14,5
19900191744,"Equality, Diversity and Inclusion",0.5,14,5
19900191863,Accounting in Europe,0.396,14,5
19900192134,Decision Sciences Journal of Innovative Education,0.417,14,5
19900192136,International Journal of Auditing,0.382,14,5
19900192338,Accounting History Review,0.402,14,5
19900193251,Journal of International Accounting Research,0.385,14,5
19900193253,Behavioral Research in Accounting,0.457,14,5
19900193855,Revista de Psicologia del Trabajo y de las Organizaciones,0.418,14,5
20500195017,Industrielle Beziehungen,0.386,14,5
21100200613,Creative Industries Journal,0.378,14,5
21100201981,"Journal of Management, Spirituality and Religion",0.387,14,5
21100203911,European Journal of Training and Development,0.477,14,5
21100211736,Tourism Analysis,0.474,14,5
21100215165,Knowledge Management and E-Learning,0.489,14,5
21100219935,International Journal of Operations and Quantitative Management,0.398,14,5
21100235632,Asian Journal of Shipping and Logistics,0.389,14,5
21100242611,International Journal of Gender and Entrepreneurship,0.445,14,5
21100248909,Tourism Review,0.459,14,5
21100248925,International Economics,0.451,14,5
21100255547,Journal of Outdoor Recreation and Tourism,0.469,14,5
21100262312,Journal of Corporate Real Estate,0.368,14,5
21100268418,Quality Management Journal,0.473,14,5
21100286465,International Journal of Entrepreneurship and Innovation,0.444,14,5
21100286906,Eurasian Mining,0.443,14,5
21100299412,International Journal of Event and Festival Management,0.388,14,5
21100304262,International Journal of Emerging Markets,0.474,14,5
21100390411,Journal of Hospitality and Tourism Education,0.406,14,5
21100395911,Asia Pacific Journal of Marketing and Logistics,0.425,14,5
21100431169,International Journal of Islamic and Middle Eastern Finance and Management,0.375,14,5
21100435972,Journal of Global Fashion Marketing,0.447,14,5
21100438074,Journal of Modelling in Management,0.491,14,5
21100446999,Journal of Global Mobility,0.377,14,5
21100455460,Journal of Heritage Tourism,0.428,14,5
21100466201,Journal for Labour Market Research,0.492,14,5
21100775632,IZA Journal of Labor and Development,0.409,14,5
21100790518,International Journal of Management Science and Engineering Management,0.464,14,5
21100834920,Journal of Education for Business,0.39,14,5
