Rank;Sourceid;Title;Type;Issn;SJR;SJR Best Quartile;H index;Total Docs. (2017);Total Docs. (3years);Total Refs.;Total Cites (3years);Citable Docs. (3years);Cites / Doc. (2years);Ref. / Doc.;Country;Publisher;Categories
999;25825;"Chemoecology";journal;"14230445, 09377409";0,764;Q3;45;24;82;1408;155;79;1,79;58,67;Switzerland;"Birkhauser Verlag";"Ecology, Evolution, Behavior and Systematics (Q2); Biochemistry (Q3)"
1000;4700152290;"Bioinspiration and Biomimetics";journal;"17483190, 17483182";0,764;Q2;49;105;323;5110;889;315;2,30;48,67;United Kingdom;"Institute of Physics Publishing";"Engineering (miscellaneous) (Q1); Biophysics (Q2); Biotechnology (Q2); Medicine (miscellaneous) (Q2); Biochemistry (Q3); Molecular Medicine (Q3)"
1001;26157;"Journal of Bone and Mineral Metabolism";journal;"09148779, 14355604";0,763;Q3;64;137;237;2641;518;235;2,25;19,28;Germany;"Springer Verlag";"Endocrinology, Diabetes and Metabolism (Q2); Medicine (miscellaneous) (Q2); Orthopedics and Sports Medicine (Q2); Endocrinology (Q3)"
1002;16134;"Process Biochemistry";journal;"13595113";0,761;Q3;130;346;842;15248;2319;838;2,59;44,07;United Kingdom;"Elsevier Applied Science";"Applied Microbiology and Biotechnology (Q2); Bioengineering (Q2); Biochemistry (Q3)"
1003;5800173385;"Recent Patents on Anti-Cancer Drug Discovery";journal;"15748928";0,760;Q3;34;27;82;3115;211;77;2,67;115,37;United Arab Emirates;"Bentham Science Publishers";"Drug Discovery (Q2); Medicine (miscellaneous) (Q2); Pharmacology (medical) (Q2); Cancer Research (Q3); Oncology (Q3)"
1004;23382;"Clinical and Experimental Pharmacology and Physiology";journal;"14401681, 03051870";0,759;Q3;93;168;446;7204;899;425;2,09;42,88;United Kingdom;"Blackwell Publishing Inc.";"Pharmacology (Q2); Physiology (Q3); Physiology (medical) (Q3)"
1005;4200151510;"Future Oncology";journal;"14796694, 17448301";0,759;Q3;57;307;982;12433;1732;847;1,98;40,50;United Kingdom;"Future Medicine Ltd.";"Medicine (miscellaneous) (Q2); Cancer Research (Q3); Oncology (Q3)"
1006;12403;"Medical Oncology";journal;"13570560";0,757;Q3;58;201;1062;8494;2080;1011;1,82;42,26;United States;"Humana Press, Inc.";"Hematology (Q2); Medicine (miscellaneous) (Q2); Cancer Research (Q3); Oncology (Q3)"
1007;14018;"Human Movement Science";journal;"01679457";0,756;Q2;76;168;427;6408;866;421;1,88;38,14;Netherlands;"Elsevier BV";"Biophysics (Q2); Medicine (miscellaneous) (Q2); Orthopedics and Sports Medicine (Q2); Sports Science (Q2); Experimental and Cognitive Psychology (Q3)"
1008;130163;"Physical Biology";journal;"14783975, 14783967";0,756;Q2;56;60;257;3480;392;251;1,59;58,00;United Kingdom;"Institute of Physics Publishing";"Biophysics (Q2); Cell Biology (Q3); Molecular Biology (Q3); Structural Biology (Q3)"
1009;21100324971;"Biotechnology Reports";journal;"2215017X";0,754;Q2;15;47;175;2202;565;171;3,20;46,85;Netherlands;"Elsevier BV";"Applied Microbiology and Biotechnology (Q2); Biotechnology (Q2)"
1010;15609;"Enzyme and Microbial Technology";journal;"01410229";0,754;Q2;126;139;431;5798;1221;424;2,96;41,71;Netherlands;"Elsevier BV";"Applied Microbiology and Biotechnology (Q2); Biotechnology (Q2); Biochemistry (Q3)"
1011;24634;"Archives of Oral Biology";journal;"00039969";0,752;Q3;74;321;616;13164;1322;607;2,13;41,01;United Kingdom;"Elsevier Ltd.";"Dentistry (miscellaneous) (Q1); Medicine (miscellaneous) (Q2); Otorhinolaryngology (Q2); Cell Biology (Q3)"
1012;12646;"Pathology Oncology Research";journal;"12194956";0,751;Q3;41;231;413;3954;738;386;1,93;17,12;Germany;"Springer Verlag";"Medicine (miscellaneous) (Q2); Pathology and Forensic Medicine (Q2); Cancer Research (Q3); Oncology (Q3)"
1013;11300153402;"Biomarkers in Medicine";journal;"17520363, 17520371";0,750;Q2;34;126;383;5520;731;338;2,15;43,81;United Kingdom;"Future Medicine Ltd.";"Biochemistry (medical) (Q2); Clinical Biochemistry (Q2); Drug Discovery (Q2)"
1014;25758;"Advances in Heterocyclic Chemistry";journal;"00652725";0,749;Q3;40;20;63;3227;198;39;4,79;161,35;United States;"Elsevier Inc.";"Polymers and Plastics (Q1); Organic Chemistry (Q2); Biochemistry (Q3)"
1015;22241;"Human Cell";journal;"09147470";0,748;Q3;32;34;70;1230;139;65;1,95;36,18;Germany;"Springer Verlag";"Medicine (miscellaneous) (Q2); Cancer Research (Q3); Cell Biology (Q3)"
1016;22081;"Cytogenetic and Genome Research";journal;"14248581, 1424859X";0,748;Q3;79;89;255;3690;384;249;1,72;41,46;Switzerland;"S. Karger AG";"Genetics (Q3); Genetics (clinical) (Q3); Molecular Biology (Q3)"
1017;18968;"Mutation Research - Genetic Toxicology and Environmental Mutagenesis";journal;"13835718";0,747;Q3;98;65;388;3296;867;374;2,13;50,71;Netherlands;"Elsevier BV";"Health, Toxicology and Mutagenesis (Q2); Genetics (Q3)"
1018;29663;"Journal of Theoretical Biology";journal;"10958541, 00225193";0,746;Q2;136;389;1386;19859;2656;1335;1,91;51,05;United States;"Elsevier Inc.";"Agricultural and Biological Sciences (miscellaneous) (Q1); Applied Mathematics (Q2); Biochemistry, Genetics and Molecular Biology (miscellaneous) (Q2); Medicine (miscellaneous) (Q2); Modeling and Simulation (Q2); Statistics and Probability (Q2); Immunology and Microbiology (miscellaneous)  (Q3)"
1019;13308;"Nutrition and Cancer";journal;"01635581, 15327914";0,745;Q3;104;155;443;6855;1058;438;2,30;44,23;United States;"Lawrence Erlbaum Associates Inc.";"Medicine (miscellaneous) (Q2); Nutrition and Dietetics (Q2); Cancer Research (Q3); Oncology (Q3)"
1020;23524;"Electrophoresis";journal;"01730835, 15222683";0,745;Q2;149;328;1152;14368;2754;1096;2,64;43,80;United Kingdom;"John Wiley & Sons Ltd.";"Analytical Chemistry (Q2); Clinical Biochemistry (Q2); Biochemistry (Q3)"
1021;16919;"Biometals";journal;"15728773, 09660844";0,744;Q2;89;80;297;4066;797;291;2,48;50,83;Netherlands;"Kluwer Academic Publishers";"Agricultural and Biological Sciences (miscellaneous) (Q1); Metals and Alloys (Q1); Biochemistry, Genetics and Molecular Biology (miscellaneous) (Q2); Biomaterials (Q2)"
1022;14858;"Biophysical Chemistry";journal;"03014622";0,743;Q2;87;119;217;5815;450;212;1,89;48,87;Netherlands;"Elsevier BV";"Biophysics (Q2); Organic Chemistry (Q2); Biochemistry (Q3)"
1023;17615;"Journal of Inorganic Biochemistry";journal;"01620134";0,743;Q3;114;248;702;14132;2223;690;2,99;56,98;Netherlands;"Elsevier BV";"Inorganic Chemistry (Q2); Biochemistry (Q3)"
1024;56471;"Euphytica";journal;"00142336, 15735060";0,742;Q3;88;291;803;13958;1435;794;1,69;47,97;Netherlands;"Kluwer Academic Publishers";"Agronomy and Crop Science (Q1); Horticulture (Q1); Plant Science (Q2); Genetics (Q3)"
1025;4700152504;"Food Biophysics";journal;"15571866, 15571858";0,740;Q2;37;49;145;2141;301;144;1,83;43,69;Germany;"Springer Verlag";"Food Science (Q1); Analytical Chemistry (Q2); Applied Microbiology and Biotechnology (Q2); Bioengineering (Q2); Biophysics (Q2)"
1026;18497;"Connective Tissue Research";journal;"03008207, 16078438";0,738;Q3;61;64;197;3284;402;188;2,33;51,31;United Kingdom;"Taylor & Francis";"Orthopedics and Sports Medicine (Q2); Rheumatology (Q2); Biochemistry (Q3); Cell Biology (Q3); Molecular Biology (Q3)"
1027;23068;"European Food Research and Technology";journal;"14382377, 14382385";0,737;Q2;83;235;640;8534;1211;631;1,87;36,31;Germany;"Springer Verlag";"Food Science (Q1); Industrial and Manufacturing Engineering (Q1); Biotechnology (Q2); Chemistry (miscellaneous) (Q2); Biochemistry (Q3)"
1028;4000149402;"Virologica Sinica";journal;"16740769, 1995820X";0,737;Q3;17;71;205;2578;281;136;2,18;36,31;China;"Ko hsueh chu pan she";"Immunology (Q3); Molecular Medicine (Q3); Virology (Q3)"
1029;25440;"Canadian Journal of Diabetes";journal;"14992671";0,736;Q3;27;124;334;3492;525;270;1,85;28,16;Canada;"Elsevier Inc.";"Endocrinology, Diabetes and Metabolism (Q2); Internal Medicine (Q2); Medicine (miscellaneous) (Q2); Endocrinology (Q3)"
1030;12602;"American Journal of Human Biology";journal;"15206300, 10420533";0,736;Q3;69;138;335;6745;559;323;1,57;48,88;United States;"John Wiley & Sons Inc.";"Anthropology (Q1); Anatomy (Q2); Ecology, Evolution, Behavior and Systematics (Q2); Genetics (Q3)"
1031;26031;"Endocrine Pathology";journal;"10463976";0,734;Q3;40;52;167;1688;350;156;2,21;32,46;United States;"Humana Press, Inc.";"Endocrinology, Diabetes and Metabolism (Q2); Medicine (miscellaneous) (Q2); Pathology and Forensic Medicine (Q2); Endocrinology (Q3)"
1032;21100317203;"Cilia";journal;"20462530";0,732;Q3;19;10;133;592;150;133;1,05;59,20;United Kingdom;"BioMed Central";"Cell Biology (Q3)"
1033;17049;"Physiological Measurement";journal;"09673334";0,731;Q2;79;178;552;7004;1280;535;2,11;39,35;United Kingdom;"Institute of Physics Publishing";"Biomedical Engineering (Q2); Biophysics (Q2); Physiology (Q3); Physiology (medical) (Q3)"
1034;19700175829;"International Journal of Molecular Epidemiology and Genetics";journal;"19481756";0,728;Q3;18;8;44;181;73;43;2,18;22,63;United States;"e-Century Publishing Corporation";"Epidemiology (Q3); Genetics (Q3); Genetics (clinical) (Q3)"
1035;23173;"Korean Journal of Physiology and Pharmacology";journal;"12264512";0,727;Q3;21;81;221;2992;453;218;1,54;36,94;South Korea;"Eui-Hak Publishing and Printing Co.";"Pharmacology (Q2); Physiology (Q3)"
1036;17808;"Trees - Structure and Function";journal;"09311890";0,726;Q3;71;156;519;9184;968;497;1,85;58,87;Germany;"Springer Verlag";"Forestry (Q1); Ecology (Q2); Plant Science (Q2); Physiology (Q3)"
1037;21100432005;"Journal of Signal Transduction";journal;"20901747, 20901739";0,726;Q3;2;0;2;0;4;2;3,00;0,00;Egypt;"Hindawi Publishing Corporation";"Biochemistry (Q3); Cell Biology (Q3); Cellular and Molecular Neuroscience (Q4)"
1038;21100202159;"BioMedicine (Netherlands)";journal;"22118020";0,725;Q2;21;25;77;1453;344;77;5,92;58,12;Netherlands;"Elsevier BV";"Biochemistry, Genetics and Molecular Biology (miscellaneous) (Q2); Medicine (miscellaneous) (Q2)"
1039;23363;"Canadian Journal of Physiology and Pharmacology";journal;"12057541, 00084212";0,724;Q3;74;168;448;8451;870;423;2,11;50,30;Canada;"NRC Research Press";"Medicine (miscellaneous) (Q2); Pharmacology (Q2); Physiology (Q3); Physiology (medical) (Q3)"
1040;17483;"Zeitschrift fr Medizinische Physik";journal;"09393889";0,722;Q2;26;46;112;986;158;96;1,42;21,43;Germany;"Urban & Fischer Verlag";"Biophysics (Q2); Radiological and Ultrasound Technology (Q2); Radiology, Nuclear Medicine and Imaging (Q2)"
1041;14154;"Molecular Biology Reports";journal;"03014851, 15734978";0,721;Q3;56;52;1213;1903;2173;1164;2,07;36,60;Netherlands;"Kluwer Academic Publishers";"Medicine (miscellaneous) (Q2); Genetics (Q3); Molecular Biology (Q3)"
1042;17700156447;"Biodemography and Social Biology";journal;"19485565";0,719;Q3;25;24;53;1165;84;51;1,22;48,54;United Kingdom;"Taylor & Francis";"Anthropology (Q1); Demography (Q2); Ecology, Evolution, Behavior and Systematics (Q2); Genetics (Q3)"
1043;16901;"Biological Trace Element Research";journal;"01634984";0,719;Q2;65;415;874;12157;2029;846;2,16;29,29;United States;"Humana Press, Inc.";"Biochemistry (medical) (Q2); Clinical Biochemistry (Q2); Endocrinology, Diabetes and Metabolism (Q2); Inorganic Chemistry (Q2); Medicine (miscellaneous) (Q2); Biochemistry (Q3)"
1044;29825;"Rejuvenation Research";journal;"15491684";0,719;Q3;50;66;269;2491;433;173;2,97;37,74;United States;"Mary Ann Liebert Inc.";"Geriatrics and Gerontology (Q2); Aging (Q3)"
1045;22100;"European Cytokine Network";journal;"11485493, 19524005";0,719;Q2;57;9;37;522;81;37;1,80;58,00;France;"John Libbey Eurotext";"Clinical Biochemistry (Q2); Immunology (Q3); Immunology and Allergy (Q3)"
1046;21100824974;"African Journal of Laboratory Medicine";journal;"22252002, 22252010";0,718;Q2;6;10;43;178;37;40;0,72;17,80;South Africa;"OpenJournals Publishing AOSIS (Pty) Ltd";"Medical Laboratory Technology (Q1); Clinical Biochemistry (Q2); Public Health, Environmental and Occupational Health (Q2)"
1047;13845;"Bulletin of Mathematical Biology";journal;"15229602, 00928240";0,717;Q2;74;140;320;4939;466;306;1,52;35,28;United States;"Springer New York LLC";"Agricultural and Biological Sciences (miscellaneous) (Q1); Biochemistry, Genetics and Molecular Biology (miscellaneous) (Q2); Computational Theory and Mathematics (Q2); Environmental Science (miscellaneous) (Q2); Mathematics (miscellaneous) (Q2); Pharmacology (Q2); Immunology (Q3); Neuroscience (miscellaneous) (Q3)"
1048;28728;"Anticancer Research";journal;"02507005";0,717;Q3;107;921;2794;25998;5194;2716;1,85;28,23;Greece;"International Institute of Anticancer Research";"Medicine (miscellaneous) (Q2); Cancer Research (Q3); Oncology (Q3)"
1049;38539;"Animal Welfare";journal;"09627286";0,716;Q2;54;45;158;2248;225;141;1,64;49,96;United Kingdom;"Universities Federation for Animal Welfare";"Animal Science and Zoology (Q1); Veterinary (miscellaneous) (Q1); Biochemistry, Genetics and Molecular Biology (miscellaneous) (Q2)"
1050;28727;"Anti-Cancer Drugs";journal;"14735741, 09594973";0,716;Q3;85;110;433;4425;834;425;1,73;40,23;United States;"Lippincott Williams & Wilkins Ltd.";"Pharmacology (Q2); Pharmacology (medical) (Q2); Cancer Research (Q3); Oncology (Q3)"
1051;16579;"Plant Breeding";journal;"14390523, 01799541";0,714;Q3;61;108;292;5183;466;291;1,51;47,99;United Kingdom;"Blackwell Publishing Inc.";"Agronomy and Crop Science (Q1); Plant Science (Q2); Genetics (Q3)"
1052;18450;"Cell Biology International";journal;"10958355, 10656995";0,712;Q3;66;162;483;5831;915;468;1,92;35,99;United States;"Wiley-Blackwell";"Medicine (miscellaneous) (Q2); Cell Biology (Q3)"
1053;14751;"International Journal of Experimental Pathology";journal;"09599673, 13652613";0,712;Q3;62;33;139;1759;275;139;2,01;53,30;United Kingdom;"Blackwell Publishing Inc.";"Pathology and Forensic Medicine (Q2); Cell Biology (Q3); Molecular Biology (Q3)"
1054;11600153418;"Current Protocols in Protein Science";journal;"19343655, 19343663";0,712;Q3;22;24;65;462;80;65;1,56;19,25;United States;"Wiley-Liss Inc";"Medicine (miscellaneous) (Q2); Biochemistry (Q3); Structural Biology (Q3)"
1055;19400158823;"Journal of Biomedical Research";journal;"16748301, 23524685";0,712;Q2;20;69;216;2669;400;191;2,12;38,68;China;"Nanjing Medical University";"Biochemistry, Genetics and Molecular Biology (miscellaneous) (Q2); Medicine (miscellaneous) (Q2)"
1056;21100853805;"Quantitative Biology";journal;"20954697, 20954689";0,711;Q2;9;36;62;1886;73;59;0,85;52,39;China;"Higher Education Press";"Applied Mathematics (Q2); Biochemistry, Genetics and Molecular Biology (miscellaneous) (Q2); Computer Science Applications (Q2); Modeling and Simulation (Q2)"
1057;20887;"Virus Genes";journal;"09208569, 1572994X";0,711;Q3;51;120;395;4526;649;392;1,61;37,72;Netherlands;"Kluwer Academic Publishers";"Medicine (miscellaneous) (Q2); Genetics (Q3); Molecular Biology (Q3); Virology (Q3)"
1058;19417;"Clinical and Experimental Nephrology";journal;"13421751, 14377799";0,711;Q3;42;239;427;4577;667;409;1,55;19,15;Germany;"Springer Verlag";"Nephrology (Q2); Physiology (Q3); Physiology (medical) (Q3)"
1059;28199;"Biomarkers";journal;"13665804, 1354750X";0,710;Q2;60;109;272;4380;487;267;1,67;40,18;United Kingdom;"Taylor & Francis";"Clinical Biochemistry (Q2); Health, Toxicology and Mutagenesis (Q2); Medicine (miscellaneous) (Q2); Biochemistry (Q3)"
1060;16833;"BMC Biochemistry";journal;"14712091";0,708;Q3;42;15;73;549;108;72;1,68;36,60;United Kingdom;"BioMed Central";"Biochemistry (Q3); Molecular Biology (Q3)"
1061;40970;"Magnetic Resonance Materials in Physics, Biology, and Medicine";journal;"09685243, 13528661";0,707;Q2;54;61;175;2002;272;172;1,50;32,82;Germany;"Springer Verlag";"Biophysics (Q2); Radiological and Ultrasound Technology (Q2); Radiology, Nuclear Medicine and Imaging (Q2)"
1062;23424;"Growth Factors";journal;"08977194, 10292292";0,707;Q2;54;17;97;850;182;96;1,83;50,00;United Kingdom;"Taylor & Francis";"Clinical Biochemistry (Q2); Cell Biology (Q3); Endocrinology (Q3)"
1063;19400158517;"Statistics in Biosciences";journal;"18671764";0,707;Q2;9;55;67;1097;54;61;0,72;19,95;United States;"Springer Science + Business Media";"Biochemistry, Genetics and Molecular Biology (miscellaneous) (Q2); Statistics and Probability (Q2)"
1064;19180;"Journal of Applied Genetics";journal;"12341983";0,704;Q3;43;61;209;2461;326;200;1,73;40,34;Poland;"Springer Verlag";"Medicine (miscellaneous) (Q2); Genetics (Q3)"
1065;36360;"Animal Reproduction Science";journal;"03784320";0,704;Q3;88;196;628;8345;1157;623;1,71;42,58;Netherlands;"Elsevier BV";"Animal Science and Zoology (Q1); Food Animals (Q1); Medicine (miscellaneous) (Q2); Endocrinology (Q3)"
1066;19700174979;"International Journal of Physiology, Pathophysiology and Pharmacology";journal;"19448171";0,704;Q3;21;20;64;804;131;61;2,26;40,20;United States;"e-Century Publishing Corporation";"Pathology and Forensic Medicine (Q2); Physiology (Q3); Physiology (medical) (Q3)"
1067;13898;"Cell Communication and Adhesion";journal;"15419061";0,702;Q2;44;2;41;59;57;35;1,75;29,50;United Kingdom;"Taylor & Francis";"Clinical Biochemistry (Q2); Medicine (miscellaneous) (Q2); Cell Biology (Q3)"
1068;17622;"Journal of Photochemistry and Photobiology B: Biology";journal;"10111344";0,698;Q2;96;379;1049;19135;3476;1032;3,27;50,49;Netherlands;"Elsevier BV";"Biophysics (Q2); Radiation (Q2); Radiological and Ultrasound Technology (Q2); Radiology, Nuclear Medicine and Imaging (Q2)"
1069;34645;"Skin Pharmacology and Physiology";journal;"16605527, 16605535";0,697;Q3;65;34;105;1530;260;103;2,23;45,00;Switzerland;"S. Karger AG";"Dermatology (Q2); Medicine (miscellaneous) (Q2); Pharmacology (Q2); Physiology (Q3)"
1070;20235;"Journal of Microbiological Methods";journal;"01677012";0,696;Q3;115;222;784;6987;1516;752;1,82;31,47;Netherlands;"Elsevier BV";"Microbiology (medical) (Q2); Microbiology (Q3); Molecular Biology (Q3)"
1071;17321;"Nuclear Medicine and Biology";journal;"09698051";0,696;Q3;81;101;369;3616;779;355;2,22;35,80;Netherlands;"Elsevier BV";"Radiology, Nuclear Medicine and Imaging (Q2); Cancer Research (Q3); Molecular Medicine (Q3)"
1072;21100218027;"Journal of Gastric Cancer";journal;"20935641, 2093582X";0,695;Q3;19;41;128;973;211;124;1,30;23,73;South Korea;"Korean Gastric Cancer Association";"Gastroenterology (Q2); Cancer Research (Q3); Oncology (Q3)"
1073;26086;"Experimental and Clinical Endocrinology and Diabetes";journal;"09477349";0,695;Q3;66;123;330;3369;492;305;1,55;27,39;Germany;"Georg Thieme Verlag";"Endocrinology, Diabetes and Metabolism (Q2); Internal Medicine (Q2); Medicine (miscellaneous) (Q2); Endocrinology (Q3)"
1074;12179;"Journal of Luminescence";journal;"00222313";0,694;Q2;101;798;2194;30892;5945;2174;2,74;38,71;Netherlands;"Elsevier BV";"Atomic and Molecular Physics, and Optics (Q2); Biophysics (Q2); Chemistry (miscellaneous) (Q2); Condensed Matter Physics (Q2); Biochemistry (Q3)"
1075;17373;"Comparative Biochemistry and Physiology - B Biochemistry and Molecular Biology";journal;"10964959";0,694;Q3;86;108;292;4780;561;289;1,72;44,26;Netherlands;"Elsevier BV";"Biochemistry (Q3); Molecular Biology (Q3); Physiology (Q3)"
1076;28755;"Brain Tumor Pathology";journal;"14337398";0,692;Q3;32;25;133;957;265;117;2,68;38,28;Germany;"Springer Verlag";"Medicine (miscellaneous) (Q2); Neurology (clinical) (Q2); Cancer Research (Q3); Oncology (Q3)"
1077;20000195094;"Cell Journal";journal;"22285806, 22285814";0,692;Q3;18;64;236;2633;500;229;2,41;41,14;Iran;"Royan Institute";"Cell Biology (Q3); Molecular Biology (Q3)"
1078;19400158544;"Probiotics and Antimicrobial Proteins";journal;"18671314, 18671306";0,692;Q3;17;133;82;2731;202;81;2,55;20,53;United States;"Springer New York LLC";"Microbiology (Q3); Molecular Biology (Q3); Molecular Medicine (Q3)"
1079;18800156706;"Molecular Medicine Reports";journal;"17913004, 17912997";0,691;Q3;35;1871;4198;67570;8282;4171;1,97;36,11;Greece;"Spandidos Publications";"Biochemistry (Q3); Cancer Research (Q3); Genetics (Q3); Molecular Biology (Q3); Molecular Medicine (Q3); Oncology (Q3)"
1080;19600166028;"BMC Research Notes";journal;"17560500";0,691;Q2;52;750;2306;20231;3517;2292;1,36;26,97;United Kingdom;"BioMed Central";"Biochemistry, Genetics and Molecular Biology (miscellaneous) (Q2); Medicine (miscellaneous) (Q2)"
1081;12552;"Oncology";journal;"08909091";0,691;Q3;66;58;489;2019;549;412;1,37;34,81;United States;"UBM Medica Healthcare Publications";"Cancer Research (Q3); Oncology (Q3)"
1082;21930;"Fish Physiology and Biochemistry";journal;"15735168, 09201742";0,690;Q3;65;140;438;7564;832;434;1,68;54,03;Netherlands;"Kluwer Academic Publishers";"Aquatic Science (Q2); Medicine (miscellaneous) (Q2); Biochemistry (Q3); Physiology (Q3)"
1083;21100467356;"Current Research in Translational Medicine";journal;"24523186";0,690;Q2;51;22;153;1026;274;137;1,78;46,64;France;"Elsevier Masson";"Biochemistry, Genetics and Molecular Biology (miscellaneous) (Q2); Medicine (miscellaneous) (Q2)"
1084;11700154323;"Image Analysis and Stereology";journal;"15803139";0,689;Q2;13;22;57;921;131;53;1,67;41,86;Slovenia;"Slovenian Society for Stereology and Quantitative Image Analysis";"Computer Vision and Pattern Recognition (Q1); Instrumentation (Q1); Acoustics and Ultrasonics (Q2); Biotechnology (Q2); Materials Science (miscellaneous) (Q2); Mathematics (miscellaneous) (Q2); Radiology, Nuclear Medicine and Imaging (Q2); Signal Processing (Q2)"
1085;19700177321;"ecancermedicalscience";journal;"17546605";0,688;Q3;14;83;326;3087;500;324;1,65;37,19;United Kingdom;"ecancer Global Foundation";"Cancer Research (Q3); Oncology (Q3)"
1086;27769;"Journal of Forensic Sciences";journal;"00221198";0,686;Q3;82;327;894;7318;1110;846;1,22;22,38;United States;"Wiley-Blackwell";"Pathology and Forensic Medicine (Q2); Genetics (Q3)"
1087;25171;"Mycotoxin Research";journal;"01787888";0,684;Q2;28;37;76;1702;215;75;3,05;46,00;Germany;"Springer Verlag";"Biotechnology (Q2); Toxicology (Q2); Microbiology (Q3)"
1088;26514;"Tetrahedron Letters";journal;"00404039";0,683;Q3;155;1146;4653;43943;9382;4581;2,09;38,34;United Kingdom;"Elsevier Ltd.";"Drug Discovery (Q2); Organic Chemistry (Q2); Biochemistry (Q3)"
1089;24030;"Respiratory Physiology and Neurobiology";journal;"15699048";0,682;Q3;86;163;508;6953;821;483;1,72;42,66;Netherlands;"Elsevier BV";"Pulmonary and Respiratory Medicine (Q2); Neuroscience (miscellaneous) (Q3); Physiology (Q3)"
1090;19900193984;"BMC Biophysics";journal;"20461682";0,682;Q2;14;7;30;263;51;30;1,69;37,57;United Kingdom;"BioMed Central";"Biophysics (Q2)"
1091;21100385419;"Progress in tumor research";journal;"22961887";0,682;Q3;6;0;30;0;39;30;1,50;0,00;Switzerland;"S. Karger AG";"Cancer Research (Q3); Oncology (Q3)"
1092;16531;"Physiological and Molecular Plant Pathology";journal;"08855765";0,682;Q3;69;59;182;3277;277;172;1,49;55,54;United States;"Elsevier Inc.";"Plant Science (Q2); Genetics (Q3)"
1093;13544;"Reproduction, Fertility and Development";journal;"10313613";0,681;Q2;66;231;416;12811;724;412;1,68;55,46;Australia;"Commonwealth Scientific and Industrial Research Organization Publishing";"Animal Science and Zoology (Q1); Biotechnology (Q2); Reproductive Medicine (Q2); Developmental Biology (Q3); Endocrinology (Q3); Genetics (Q3); Molecular Biology (Q3)"
1094;26990;"Molecular Physics";journal;"00268976, 13623028";0,680;Q2;94;329;1079;14269;1664;1048;1,61;43,37;United Kingdom;"Taylor & Francis";"Biophysics (Q2); Condensed Matter Physics (Q2); Physical and Theoretical Chemistry (Q2); Molecular Biology (Q3)"
1095;4700152486;"Plasmonics";journal;"15571955";0,679;Q2;41;365;622;8277;1319;612;2,13;22,68;Germany;"Springer Verlag";"Biophysics (Q2); Biotechnology (Q2); Nanoscience and Nanotechnology (Q2); Biochemistry (Q3)"
1096;6400153147;"Journal of Molecular Signaling";journal;"17502187";0,677;Q3;27;0;20;0;32;20;0,64;0,00;United Kingdom;"BioMed Central";"Biochemistry (Q3); Cell Biology (Q3); Molecular Biology (Q3)"
1097;21378;"Viral Immunology";journal;"08828245";0,677;Q3;56;92;247;4280;319;215;1,49;46,52;United States;"Mary Ann Liebert Inc.";"Immunology (Q3); Molecular Medicine (Q3); Virology (Q3)"
1098;15541;"Biotechnology Progress";journal;"87567938, 15206033";0,676;Q2;113;181;526;7275;1109;519;1,98;40,19;United States;"Wiley-Blackwell";"Biotechnology (Q2)"
1099;23446;"Journal of Applied Biomechanics";journal;"10658483, 15432688";0,675;Q2;47;72;249;2193;353;248;1,27;30,46;United States;"Human Kinetics Publishers Inc.";"Biophysics (Q2); Orthopedics and Sports Medicine (Q2); Rehabilitation (Q2); Sports Science (Q3)"
1100;16337;"Journal of Bioscience and Bioengineering";journal;"13891723, 13474421";0,675;Q2;93;231;717;7529;1567;699;2,05;32,59;Netherlands;"Elsevier BV";"Applied Microbiology and Biotechnology (Q2); Bioengineering (Q2); Biotechnology (Q2)"
1101;21100455212;"Biomedical Reports";journal;"20499442, 20499434";0,675;Q2;8;130;78;4391;152;78;1,82;33,78;Greece;"Spandidos Publications";"Pharmacology, Toxicology and Pharmaceutics (miscellaneous) (Q1); Biochemistry, Genetics and Molecular Biology (miscellaneous) (Q2); Medicine (miscellaneous) (Q2); Neuroscience (miscellaneous) (Q3)"
1102;29318;"Anti-Cancer Agents in Medicinal Chemistry";journal;"18755992, 18715206";0,674;Q3;80;176;481;7473;1032;447;2,14;42,46;United Arab Emirates;"Bentham Science Publishers";"Pharmacology (Q2); Cancer Research (Q3); Molecular Medicine (Q3)"
1103;21100464738;"Interdisciplinary topics in gerontology and geriatrics";journal;"22973486, 22973508";0,672;Q3;18;0;63;0;117;58;1,35;0,00;Switzerland;"S. Karger AG";"Geriatrics and Gerontology (Q2); Aging (Q3)"
1104;24819;"Natural Product Research";journal;"14786419";0,671;Q3;40;846;1338;10198;2375;1291;1,86;12,05;United Kingdom;"Taylor & Francis";"Analytical Chemistry (Q2); Organic Chemistry (Q2); Plant Science (Q2); Biochemistry (Q3)"
1105;14123;"Lipids";journal;"00244201";0,670;Q3;111;99;361;4214;715;351;2,03;42,57;United States;"Springer Verlag";"Organic Chemistry (Q2); Biochemistry (Q3); Cell Biology (Q3)"
1106;28496;"Aging - Clinical and Experimental Research";journal;"15940667, 17208319";0,670;Q3;60;277;400;6568;701;386;1,92;23,71;Germany;"Springer Verlag";"Geriatrics and Gerontology (Q2); Aging (Q3)"
