Rank;Sourceid;Title;Type;Issn;SJR;SJR Best Quartile;H index;Total Docs. (2017);Total Docs. (3years);Total Refs.;Total Cites (3years);Citable Docs. (3years);Cites / Doc. (2years);Ref. / Doc.;Country;Publisher;Categories
1518;21100824892;"Law, Innovation and Technology";journal;"17579961, 1757997X";0,309;Q3;8;9;30;236;30;23;0,88;26,22;United Kingdom;"Taylor and Francis Ltd.";"Computer Science (miscellaneous) (Q2); Law (Q2); Artificial Intelligence (Q3); Biotechnology (Q3); Computer Science Applications (Q3)"
1519;5900153316;"Journal of Medical Biochemistry";journal;"14528258, 14528266";0,307;Q3;12;42;121;1246;127;119;1,56;29,67;Serbia;"Society of Medical Biochemists of Serbia";"Biochemistry (medical) (Q3); Clinical Biochemistry (Q3)"
1520;22804;"Chemical Papers";journal;"03666352";0,306;Q4;34;248;572;9910;645;560;0,92;39,96;Switzerland;"Springer International Publishing AG";"Industrial and Manufacturing Engineering (Q2); Chemical Engineering (miscellaneous) (Q3); Chemistry (miscellaneous) (Q3); Materials Chemistry (Q3); Biochemistry (Q4)"
1521;19700188407;"International Journal of Biochemistry and Molecular Biology";journal;"21524114";0,306;Q4;25;2;10;125;15;10;2,00;62,50;United States;"e-Century Publishing Corporation";"Biochemistry (Q4); Molecular Biology (Q4)"
1522;21100200806;"BMC Proceedings";journal;"17536561";0,302;Q3;12;25;213;913;119;211;0,64;36,52;United Kingdom;"BioMed Central";"Biochemistry, Genetics and Molecular Biology (miscellaneous) (Q3); Medicine (miscellaneous) (Q3)"
1523;21100416147;"Reproductive Biomedicine and Society Online";journal;"24056618";0,300;Q4;5;10;47;374;23;41;0,56;37,40;United Kingdom;"Elsevier Limited";"Cultural Studies (Q1); Health (social science) (Q3); Reproductive Medicine (Q3); Developmental Biology (Q4)"
1524;9500154033;"Biologia (Poland)";journal;"13369563, 00063088";0,299;Q4;29;156;578;7131;499;574;0,79;45,71;Germany;"Walter de Gruyter GmbH";"Animal Science and Zoology (Q3); Ecology, Evolution, Behavior and Systematics (Q3); Plant Science (Q3); Biochemistry (Q4); Cell Biology (Q4); Genetics (Q4); Molecular Biology (Q4)"
1525;12300154908;"IRBM";journal;"19590318";0,298;Q3;24;50;134;1149;128;122;0,92;22,98;France;"Elsevier Masson";"Biomedical Engineering (Q3); Biophysics (Q3)"
1526;26766;"ATLA Alternatives to Laboratory Animals";journal;"02611929";0,297;Q3;54;32;167;934;138;133;1,27;29,19;United Kingdom;"Fund for the Replacement of Animals in Medical Experiments";"Medical Laboratory Technology (Q2); Biochemistry, Genetics and Molecular Biology (miscellaneous) (Q3); Medicine (miscellaneous) (Q3); Toxicology (Q4)"
1527;24640;"Journal of Liquid Chromatography and Related Technologies";journal;"10826076, 1520572X";0,297;Q3;44;120;573;4358;464;569;0,89;36,32;United States;"Marcel Dekker Inc.";"Pharmaceutical Science (Q2); Analytical Chemistry (Q3); Clinical Biochemistry (Q3); Biochemistry (Q4)"
1528;13202;"Ultrastructural Pathology";journal;"15210758, 01913123";0,295;Q4;37;43;168;1574;132;160;0,70;36,60;United Kingdom;"Taylor & Francis";"Pathology and Forensic Medicine (Q3); Structural Biology (Q4)"
1529;14552;"Doklady Biological Sciences";journal;"16083105, 00124966";0,294;Q3;14;65;260;819;125;258;0,42;12,60;Russian Federation;"Maik Nauka/Interperiodica Publishing";"Agricultural and Biological Sciences (miscellaneous) (Q2); Biochemistry, Genetics and Molecular Biology (miscellaneous) (Q3); Medicine (miscellaneous) (Q3); Immunology and Microbiology (miscellaneous)  (Q4)"
1530;21100394093;"Extreme Physiology and Medicine";journal;"20467648";0,293;Q4;15;3;215;119;168;204;0,51;39,67;United Kingdom;"BioMed Central";"Orthopedics and Sports Medicine (Q3); Physiology (medical) (Q3); Physiology (Q4)"
1531;4700152612;"Current Nanoscience";journal;"15734137";0,292;Q3;35;76;345;3682;358;321;1,24;48,45;United Arab Emirates;"Bentham Science Publishers";"Pharmaceutical Science (Q2); Bioengineering (Q3); Biomedical Engineering (Q3); Biotechnology (Q3); Medicine (miscellaneous) (Q3); Nanoscience and Nanotechnology (Q3)"
1532;19600157004;"Journal of Proteomics and Bioinformatics";journal;"0974276X";0,291;Q4;15;0;38;0;28;34;0,00;0,00;India;"Omics Publishing Group";"Computer Science Applications (Q3); Biochemistry (Q4); Cell Biology (Q4); Molecular Biology (Q4)"
1533;19200157039;"Tropical Life Sciences Research";journal;"19858345, 21804249";0,290;Q3;9;27;79;1009;82;78;0,85;37,37;Malaysia;"Universiti Sains Malaysia";"Agricultural and Biological Sciences (miscellaneous) (Q2); Biochemistry, Genetics and Molecular Biology (miscellaneous) (Q3); Medicine (miscellaneous) (Q3)"
1534;4700152284;"Turkish Journal of Biology";journal;"13000152";0,288;Q4;29;95;326;4461;283;324;0,72;46,96;Turkey;"Scientific and Technical research Council of Turkey - TUBITAK/Turkiye Bilimsel ve Teknik Arastirma Kurumu";"Agricultural and Biological Sciences (miscellaneous) (Q2); Cell Biology (Q4); Genetics (Q4); Microbiology (Q4); Molecular Biology (Q4); Physiology (Q4)"
1535;12100154839;"Applied Bionics and Biomechanics";journal;"11762322";0,288;Q3;15;48;87;1675;126;85;1,40;34,90;Egypt;"Hindawi Publishing Corporation";"Bioengineering (Q3); Biomedical Engineering (Q3); Biotechnology (Q3); Medicine (miscellaneous) (Q3)"
1536;21100420317;"Biochimie Open";journal;"22140085";0,288;Q4;4;18;27;771;26;25;1,04;42,83;Netherlands;"Elsevier BV";"Biochemistry (Q4)"
1537;14954;"Zeitschrift fr Naturforschung - Section C Journal of Biosciences";journal;"09395075";0,288;Q3;57;60;156;2399;143;155;0,94;39,98;Germany;"Walter de Gruyter GmbH";"Biochemistry, Genetics and Molecular Biology (miscellaneous) (Q3)"
1538;130153;"Sleep and Biological Rhythms";journal;"14469235, 14798425";0,287;Q4;24;47;160;1534;89;142;0,58;32,64;Germany;"Springer Verlag";"Neuropsychology and Physiological Psychology (Q3); Physiology (medical) (Q3); Neurology (Q4); Physiology (Q4)"
1539;5300152528;"Journal of Essential Oil-Bearing Plants";journal;"0972060X";0,287;Q4;18;152;581;4883;405;580;0,72;32,13;United Kingdom;"Taylor & Francis";"Analytical Chemistry (Q3); Biochemistry (Q4); Organic Chemistry (Q4)"
1540;15075;"Folia Biologica";journal;"00155497";0,285;Q3;20;26;119;1043;86;118;0,52;40,12;Poland;"Polska Akademia Nauk";"Biochemistry, Genetics and Molecular Biology (miscellaneous) (Q3); Medicine (miscellaneous) (Q3)"
1541;12456;"Acta Biotheoretica";journal;"00015342, 15728358";0,284;Q3;30;15;81;586;63;76;0,96;39,07;Netherlands;"Springer Netherlands";"Agricultural and Biological Sciences (miscellaneous) (Q2); Philosophy (Q2); Applied Mathematics (Q3); Biochemistry, Genetics and Molecular Biology (miscellaneous) (Q3); Environmental Science (miscellaneous) (Q3); Medicine (miscellaneous) (Q3)"
1542;19900192508;"Biomedicine and Aging Pathology";journal;"22105220";0,284;Q4;11;0;52;0;63;52;0,00;0,00;France;"Elsevier Masson";"Geriatrics and Gerontology (Q3); Pathology and Forensic Medicine (Q3); Aging (Q4)"
1543;19700175004;"Open Medicinal Chemistry Journal";journal;"18741045";0,281;Q4;14;15;11;649;10;11;0,71;43,27;United Arab Emirates;"Bentham Science Publishers";"Pharmaceutical Science (Q2); Drug Discovery (Q3); Pharmacology (Q3); Molecular Medicine (Q4)"
1544;26563;"Acta Medica Okayama";journal;"0386300X";0,281;Q3;32;75;184;1861;120;180;0,63;24,81;Japan;"Okayama Daigaku";"Biochemistry, Genetics and Molecular Biology (miscellaneous) (Q3); Medicine (miscellaneous) (Q3)"
1545;18430;"Caryologia";journal;"00087114";0,281;Q4;26;48;144;1964;85;140;0,61;40,92;United Kingdom;"Taylor & Francis";"Agricultural and Biological Sciences (miscellaneous) (Q2); Genetics (Q4)"
1546;21100205972;"Journal of Healthcare Engineering";journal;"20402295";0,280;Q3;14;170;67;5793;81;67;1,22;34,08;United Kingdom;"Hindawi Publishing Corporation";"Biomedical Engineering (Q3); Biotechnology (Q3); Health Informatics (Q3); Surgery (Q3)"
1547;21100206281;"Biophysics (Japan)";journal;"13492942";0,280;Q3;9;0;27;0;20;25;1,21;0,00;Japan;"Biophysical Society of Japan";"Biophysics (Q3)"
1548;21100788814;"Physics in Medicine";journal;"23524510";0,280;Q3;1;4;4;127;5;4;1,25;31,75;Netherlands;"Elsevier BV";"Biophysics (Q3); Instrumentation (Q3); Radiology, Nuclear Medicine and Imaging (Q3)"
1549;19644;"Technology and Health Care";journal;"09287329";0,279;Q3;39;166;465;3912;386;453;0,82;23,57;Netherlands;"IOS Press";"Bioengineering (Q3); Biomedical Engineering (Q3); Biophysics (Q3); Health Informatics (Q3); Information Systems (Q3); Medicine (miscellaneous) (Q3); Biomaterials (Q4)"
1550;7200153144;"Molluscan Research";journal;"13235818";0,279;Q4;21;37;80;1158;41;78;0,50;31,30;United Kingdom;"Taylor & Francis";"Animal Science and Zoology (Q3); Ecology, Evolution, Behavior and Systematics (Q3); Genetics (Q4)"
1551;21100241729;"Frontiers in Life Science";journal;"21553777, 21553769";0,279;Q3;30;2;83;251;82;73;1,12;125,50;United Kingdom;"Taylor and Francis Inc.";"Biochemistry, Genetics and Molecular Biology (miscellaneous) (Q3); Neuroscience (miscellaneous) (Q4)"
1552;22234;"Hereditas";journal;"16015223, 00180661";0,278;Q4;44;16;48;284;32;47;0,55;17,75;United Kingdom;"BioMed Central";"Medicine (miscellaneous) (Q3); Genetics (Q4)"
1553;16800154714;"Lipid Technology";journal;"18635377, 0956666X";0,278;Q3;16;24;149;71;82;132;0,66;2,96;United States;"Wiley-Blackwell";"Biochemistry, Genetics and Molecular Biology (miscellaneous) (Q3); Control and Systems Engineering (Q3); Food Science (Q3)"
1554;5700165213;"Czech Journal of Genetics and Plant Breeding";journal;"12121975, 18059325";0,277;Q4;13;23;86;631;58;85;0,51;27,43;Czech Republic;"Ceska Akademie Zemedelskych Ved";"Plant Science (Q3); Genetics (Q4)"
1555;12596;"Breast Disease";journal;"08886008";0,276;Q4;31;10;84;231;59;83;0,73;23,10;Netherlands;"IOS Press";"Medicine (miscellaneous) (Q3); Oncology (Q3); Cancer Research (Q4)"
1556;25299;"Journal of the Pancreas";journal;"15908577";0,275;Q4;44;0;219;0;126;187;0,95;0,00;Italy;"E S Burioni Ricerche Bibliografiche";"Endocrinology, Diabetes and Metabolism (Q3); Medicine (miscellaneous) (Q3); Endocrinology (Q4); Hepatology (Q4)"
1557;21100371966;"Open Life Sciences";journal;"23915412";0,271;Q3;26;57;252;2078;221;250;0,77;36,46;Germany;"Walter de Gruyter GmbH";"Agricultural and Biological Sciences (miscellaneous) (Q3); Biochemistry, Genetics and Molecular Biology (miscellaneous) (Q3); Immunology and Microbiology (miscellaneous)  (Q4); Neuroscience (miscellaneous) (Q4)"
1558;18889;"Indian Journal of Human Genetics";journal;"09716866";0,270;Q4;16;0;40;0;31;36;0,00;0,00;India;"Medknow Publications";"Genetics (Q4); Genetics (clinical) (Q4)"
1559;26196;"Hsi-An Chiao Tung Ta Hsueh/Journal of Xi'an Jiaotong University";journal;"0253987X";0,268;Q4;22;253;824;3661;384;824;0,49;14,47;China;"Xi'an Jiaotong University";"Engineering (miscellaneous) (Q2); Medicine (miscellaneous) (Q3); Clinical Biochemistry (Q4)"
1560;13843;"Bulletin of Experimental Biology and Medicine";journal;"15738221, 00074888";0,268;Q3;29;378;1230;5077;702;1213;0,58;13,43;Netherlands;"Kluwer Academic Publishers";"Biochemistry, Genetics and Molecular Biology (miscellaneous) (Q3); Medicine (miscellaneous) (Q3)"
1561;21100847272;"Applied Food Biotechnology";journal;"24234214, 23455357";0,268;Q3;5;25;64;974;66;64;0,91;38,96;Iran;"National Nutrition and Food Technology Research Institute";"Applied Microbiology and Biotechnology (Q3); Biotechnology (Q3); Food Science (Q3)"
1562;5200152621;"Proceedings of the National Academy of Sciences India Section A - Physical Sciences";journal;"03698203, 22501762";0,267;Q3;9;83;193;3339;151;189;0,74;40,23;India;"Springer India";"Biochemistry, Genetics and Molecular Biology (miscellaneous) (Q3); Physics and Astronomy (miscellaneous) (Q3)"
1563;19400157005;"Journal of Hard Tissue Biology";journal;"13417649, 1880828X";0,266;Q4;9;63;181;1775;112;178;0,59;28,17;Japan;"Japanese Society of Hard Tissue Research & Technology";"Dentistry (miscellaneous) (Q3); Medicine (miscellaneous) (Q3); Orthopedics and Sports Medicine (Q3); Biochemistry (Q4); Biomaterials (Q4); Cell Biology (Q4)"
1564;21100199504;"Genomics Insights";journal;"11786310";0,263;Q4;5;3;8;145;4;8;0,50;48,33;New Zealand;"Libertas Academica Ltd.";"Biochemistry (Q4); Cell Biology (Q4); Genetics (Q4); Molecular Biology (Q4)"
1565;96929;"Maydica";journal;"22798013, 00256153";0,263;Q4;31;18;88;724;52;88;0,33;40,22;Italy;"Istituto sperimentale per la cerealicoltura";"Agronomy and Crop Science (Q3); Plant Science (Q3); Genetics (Q4)"
1566;15393;"Biocatalysis and Biotransformation";journal;"10242422";0,262;Q3;42;71;111;1932;96;109;0,78;27,21;United Kingdom;"Taylor & Francis";"Biotechnology (Q3); Biochemistry (Q4); Catalysis (Q4)"
1567;17200;"The Malaysian journal of pathology";journal;"01268635";0,262;Q4;15;50;120;1106;69;110;0,62;22,12;Malaysia;"Malaysian Society of Pathologists";"Medicine (miscellaneous) (Q3); Pathology and Forensic Medicine (Q3); Cell Biology (Q4); Histology (Q4)"
1568;19700201610;"Open Biochemistry Journal";journal;"1874091X";0,262;Q3;10;11;25;564;23;25;0,50;51,27;Netherlands;"Bentham Science Publishers B.V.";"Biochemistry, Genetics and Molecular Biology (miscellaneous) (Q3)"
1569;23201;"Food Science and Technology Research";journal;"13446606";0,261;Q3;34;22;373;669;187;371;0,37;30,41;Switzerland;"S. Karger AG";"Industrial and Manufacturing Engineering (Q2); Biotechnology (Q3); Chemical Engineering (miscellaneous) (Q3); Food Science (Q3); Marketing (Q3)"
1570;19700188444;"Journal of Microbial and Biochemical Technology";journal;"19485948";0,260;Q3;12;0;59;0;49;56;0,00;0,00;India;"OMICS Publishing Group";"Applied Microbiology and Biotechnology (Q3); Biotechnology (Q3); Biochemistry (Q4); Microbiology (Q4)"
1571;4700152642;"Journal fr Verbraucherschutz und Lebensmittelsicherheit";journal;"16615751";0,260;Q3;20;62;162;997;95;141;0,62;16,08;Germany;"Birkhauser Verlag";"Agronomy and Crop Science (Q3); Biotechnology (Q3); Food Animals (Q3); Food Science (Q3)"
1572;4700152609;"Current Computer-Aided Drug Design";journal;"15734099";0,259;Q4;24;33;116;1286;98;100;0,85;38,97;United Arab Emirates;"Bentham Science Publishers";"Drug Discovery (Q3); Medicine (miscellaneous) (Q3); Molecular Medicine (Q4)"
1573;17433;"Doklady Biochemistry and Biophysics";journal;"16076729, 16083091";0,257;Q4;15;105;292;1309;174;291;0,63;12,47;Russian Federation;"Maik Nauka/Interperiodica Publishing";"Chemistry (miscellaneous) (Q3); Medicine (miscellaneous) (Q3); Biochemistry (Q4); Biophysics (Q4)"
1574;14153;"Molecular Biology";journal;"00268933, 16083245";0,256;Q4;19;111;326;5197;185;324;0,58;46,82;Russian Federation;"Maik Nauka/Interperiodica Publishing";"Biophysics (Q4); Structural Biology (Q4)"
1575;21100853557;"Endoplasmic Reticulum Stress in Diseases";journal;"23004266";0,254;Q4;1;0;2;0;2;2;1,00;0,00;Poland;"De Gruyter Open Ltd.";"Medicine (miscellaneous) (Q3); Cell Biology (Q4)"
1576;13000154719;"Journal of Bionanoscience";journal;"15577929, 15577910";0,253;Q3;16;81;206;3211;171;204;0,95;39,64;United States;"American Scientific Publishers";"Biomedical Engineering (Q3); Biotechnology (Q3); Biomaterials (Q4); Nanoscience and Nanotechnology (Q4)"
1577;21100838766;"Frontiers of Agricultural Science and Engineering";journal;"20957505, 2095977X";0,252;Q3;5;58;122;2448;81;113;0,62;42,21;China;"Higher Education Press Limited Company";"Agricultural and Biological Sciences (miscellaneous) (Q3); Biotechnology (Q3); Veterinary (miscellaneous) (Q3)"
1578;5800173405;"Current Bioinformatics";journal;"15748936";0,251;Q4;22;51;225;2369;122;205;0,51;46,45;United Arab Emirates;"Bentham Science Publishers";"Computational Mathematics (Q3); Biochemistry (Q4); Genetics (Q4); Molecular Biology (Q4)"
1579;19700180534;"Interdisciplinary sciences, computational life sciences";journal;"19132751, 18671462";0,250;Q3;13;50;135;2060;95;133;0,57;41,20;Germany;"Springer Verlag";"Biochemistry, Genetics and Molecular Biology (miscellaneous) (Q3); Computer Science Applications (Q3); Health Informatics (Q3)"
1580;24049;"Acta Physiologica Sinica";journal;"03710874";0,250;Q4;22;29;253;0;129;252;0,50;0,00;China;"Science Press";"Medicine (miscellaneous) (Q3); Physiology (Q4)"
1581;21100827188;"Cancer Treatment and Research Communications";journal;"24682942";0,250;Q4;5;31;119;1060;52;118;0,40;34,19;United Kingdom;"Elsevier Ltd";"Oncology (Q3); Cancer Research (Q4)"
1582;24059;"Journal of Planar Chromatography - Modern TLC";journal;"09334173";0,249;Q4;28;76;222;1921;124;211;0,47;25,28;Hungary;"Akademiai Kiado Rt.";"Analytical Chemistry (Q3); Biochemistry (Q4); Clinical Biochemistry (Q4)"
1583;24041;"Journal of Immunoassay and Immunochemistry";journal;"15324230, 15321819";0,249;Q4;24;57;147;1633;92;145;0,68;28,65;United States;"Marcel Dekker Inc.";"Medical Laboratory Technology (Q3); Clinical Biochemistry (Q4); Immunology (Q4); Immunology and Allergy (Q4)"
1584;21100278103;"Journal of Biomaterials and Tissue Engineering";journal;"21579091, 21579083";0,248;Q3;17;149;400;5123;383;397;0,85;34,38;United States;"American Scientific Publishers";"Biomedical Engineering (Q3); Biotechnology (Q3); Medicine (miscellaneous) (Q3); Bioengineering (Q4)"
1585;21100413900;"Genetika";journal;"05340012, 18206069";0,248;Q4;9;92;267;3161;129;264;0,45;34,36;Serbia;"Drustvo Geneticara Srbije";"Agricultural and Biological Sciences (miscellaneous) (Q3); Plant Science (Q3); Genetics (Q4)"
1586;130038;"Letters in Drug Design and Discovery";journal;"15701808";0,247;Q4;25;149;371;5398;350;368;0,86;36,23;United Arab Emirates;"Bentham Science Publishers";"Drug Discovery (Q3); Pharmaceutical Science (Q3); Molecular Medicine (Q4)"
1587;19700190355;"Revista Brasileira de Cineantropometria e Desempenho Humano";journal;"14158426, 19800037";0,247;Q4;17;72;227;2027;123;225;0,47;28,15;Brazil;"Universidade Federal de Santa Catarina";"Physiology (Q4); Physiology (medical) (Q4)"
1588;13606;"Biology Bulletin";journal;"10623590, 16083059";0,245;Q3;15;156;382;5054;174;382;0,41;32,40;Russian Federation;"Maik Nauka/Interperiodica Publishing";"Agricultural and Biological Sciences (miscellaneous) (Q3); Biochemistry, Genetics and Molecular Biology (miscellaneous) (Q3)"
1589;21100853500;"Clinical Cancer Drugs";journal;"22126988, 2212697X";0,242;Q4;2;0;6;0;7;6;1,17;0,00;United Arab Emirates;"Bentham Science Publishers";"Pharmacology, Toxicology and Pharmaceutics (miscellaneous) (Q2); Oncology (Q3); Cancer Research (Q4)"
1590;13264;"Biological Rhythm Research";journal;"09291016";0,242;Q4;28;129;255;3534;169;252;0,69;27,40;United Kingdom;"Taylor & Francis";"Ecology, Evolution, Behavior and Systematics (Q4); Physiology (Q4); Physiology (medical) (Q4)"
1591;85637;"Cereal Research Communications";journal;"01333720";0,242;Q4;28;64;201;2067;124;198;0,55;32,30;Hungary;"Gabonatermesztesi Kutato Kozhasznu Tarsasag/Cereal Research Non-Profit Company";"Agronomy and Crop Science (Q3); Genetics (Q4); Physiology (Q4)"
1592;21100821160;"International Journal of Molecular and Cellular Medicine";journal;"22519637, 22519645";0,242;Q3;3;27;30;841;24;27;0,89;31,15;Iran;"Babol University of Medical Sciences";"Biotechnology (Q3); Biochemistry (Q4); Cell Biology (Q4); Genetics (Q4); Molecular Biology (Q4); Molecular Medicine (Q4)"
1593;25288;"Phosphorus, Sulfur and Silicon and the Related Elements";journal;"10426507, 15635325";0,241;Q4;37;209;802;6915;589;781;0,73;33,09;United Kingdom;"Taylor & Francis";"Biochemistry (Q4); Inorganic Chemistry (Q4); Organic Chemistry (Q4)"
1594;58246;"Outlooks on Pest Management";journal;"17431026, 14658933";0,241;Q3;28;39;122;290;46;80;0,57;7,44;United Kingdom;"Research Information Ltd.";"Agronomy and Crop Science (Q3); Biotechnology (Q3); Food Science (Q3); Insect Science (Q4)"
1595;19200156941;"Digest Journal of Nanomaterials and Biostructures";journal;"18423582";0,240;Q4;33;139;474;3885;377;474;0,65;27,95;Romania;"National Institute R&D Materials Physics";"Biomedical Engineering (Q3); Materials Science (miscellaneous) (Q3); Atomic and Molecular Physics, and Optics (Q4); Condensed Matter Physics (Q4); Nanoscience and Nanotechnology (Q4); Physical and Theoretical Chemistry (Q4); Structural Biology (Q4)"
1596;12400154743;"Mitochondrial DNA";journal;"19401736, 19401744";0,240;Q4;27;0;1847;0;847;1699;0,49;0,00;United Kingdom;"Informa Healthcare";"Genetics (Q4); Molecular Biology (Q4)"
1597;19900193995;"Indian Journal of Genetics and Plant Breeding";journal;"00195200, 09756906";0,240;Q4;10;97;307;2370;137;277;0,49;24,43;India;"Indian Society of Genetics & Plant Breeding.";"Plant Science (Q3); Genetics (Q4)"
1598;130175;"Journal of the ICRU";journal;"14736691";0,239;Q4;7;0;3;0;1;3;0,00;0,00;United Kingdom;"Oxford University Press";"Radiation (Q3); Radiology, Nuclear Medicine and Imaging (Q3); Biophysics (Q4)"
1599;18700156727;"Animal Cells and Systems";journal;"19768354";0,236;Q3;10;54;162;1657;76;157;0,48;30,69;United Kingdom;"Taylor & Francis";"Animal Science and Zoology (Q3); Biochemistry, Genetics and Molecular Biology (miscellaneous) (Q3)"
1600;23285;"Natures Sciences Societes";journal;"17652979, 12401307";0,235;Q3;15;41;122;934;38;99;0,41;22,78;France;"EDP Sciences";"Multidisciplinary (Q2); Agricultural and Biological Sciences (miscellaneous) (Q3); Biochemistry, Genetics and Molecular Biology (miscellaneous) (Q3); Earth and Planetary Sciences (miscellaneous) (Q3); Environmental Science (miscellaneous) (Q3); Social Sciences (miscellaneous) (Q3)"
1601;144782;"e-Journal of Surface Science and Nanotechnology";journal;"13480391";0,234;Q3;18;23;233;629;102;229;0,44;27,35;Japan;"Surface Science Society of Japan";"Biotechnology (Q3); Mechanics of Materials (Q3); Surfaces, Coatings and Films (Q3); Bioengineering (Q4); Condensed Matter Physics (Q4); Nanoscience and Nanotechnology (Q4); Surfaces and Interfaces (Q4)"
1602;21100399127;"Recent Advances in DNA and Gene Sequences";journal;"23520930, 23520922";0,234;Q3;16;0;26;0;18;24;0,78;0,00;Netherlands;"Bentham Science Publishers B.V.";"Biotechnology (Q3); Genetics (clinical) (Q4); Molecular Biology (Q4)"
1603;18508;"Cytologia";journal;"00114545";0,233;Q4;26;89;210;2692;89;197;0,48;30,25;Japan;"Japan Mendel Society";"Animal Science and Zoology (Q3); Plant Science (Q3); Cell Biology (Q4); Genetics (Q4)"
1604;12300154711;"Archives of Biological Sciences";journal;"03544664";0,232;Q3;18;99;469;3960;264;437;0,67;40,00;Serbia;"Serbian Biological Society";"Agricultural and Biological Sciences (miscellaneous) (Q3); Biochemistry, Genetics and Molecular Biology (miscellaneous) (Q3)"
1605;19900193629;"International Journal Bioautomation";journal;"13142321, 13141902";0,231;Q3;7;30;126;871;69;126;0,60;29,03;Bulgaria;"Institute of Biophysics and Biomedical Engineering at the Bulgarian Academy of Sciences";"Biotechnology (Q3); Food Science (Q3); Biochemistry (Q4); Ecological Modeling (Q4); Genetics (Q4)"
1606;28071;"Aviakosmicheskaia i ekologicheskaia meditsina = Aerospace and environmental medicine";journal;"0233528X";0,228;Q3;12;58;199;981;59;196;0,27;16,91;Russian Federation;"Redaktsiya Zhurnala Aviakosmicheskaya i Ekologicheskaya Meditsina";"Biochemistry, Genetics and Molecular Biology (miscellaneous) (Q3); Medicine (miscellaneous) (Q3)"
1607;21100852986;"Systems Biomedicine";journal;"21628149, 21628130";0,228;Q3;4;0;10;0;6;10;0,67;0,00;United Kingdom;"Taylor and Francis Ltd.";"Biotechnology (Q3); Medicine (miscellaneous) (Q3); Biochemistry (Q4); Cell Biology (Q4); Genetics (Q4); Genetics (clinical) (Q4)"
1608;19800188010;"Sabrao Journal of Breeding and Genetics";journal;"10297073";0,227;Q3;9;33;127;1120;52;127;0,30;33,94;Japan;"Society for the Advancement of Breeding Researches in Asia and Oceania (SABRAO)";"Agronomy and Crop Science (Q3); Animal Science and Zoology (Q3); Biotechnology (Q3); Horticulture (Q3); Genetics (Q4)"
1609;12453;"Acta Biologica Hungarica";journal;"02365383";0,226;Q3;25;43;125;1076;64;124;0,49;25,02;Hungary;"Akademiai Kiado";"Biochemistry, Genetics and Molecular Biology (miscellaneous) (Q3); Environmental Science (miscellaneous) (Q3); Neurology (Q4)"
1610;144653;"Artificial Life and Robotics";journal;"14335298";0,226;Q3;16;85;191;1061;90;191;0,52;12,48;Germany;"Springer Verlag";"Artificial Intelligence (Q3); Biochemistry, Genetics and Molecular Biology (miscellaneous) (Q3)"
1611;17232;"Silvae Genetica";journal;"00375349, 25098934";0,225;Q4;34;0;62;0;26;62;0,40;0,00;Germany;"De Gruyter Open";"Forestry (Q3); Genetics (Q4)"
1612;12194;"Revista Espanola de Geriatria y Gerontologia";journal;"0211139X";0,225;Q4;16;131;249;2194;129;169;0,77;16,75;Spain;"Ediciones Doyma S.A.";"Geriatrics and Gerontology (Q3); Medicine (miscellaneous) (Q3); Aging (Q4)"
1613;16007;"Journal of Smooth Muscle Research";journal;"09168737";0,225;Q4;29;8;28;390;21;28;0,65;48,75;Japan;"Japanese Society of Smooth Muscle Research";"Medicine (miscellaneous) (Q3); Physiology (Q4)"
1614;4700152426;"Current Pharmaceutical Analysis";journal;"15734129";0,224;Q4;20;71;144;2018;101;135;0,74;28,42;United Arab Emirates;"Bentham Science Publishers";"Pharmaceutical Science (Q3); Biochemistry (Q4); Biophysics (Q4); Molecular Medicine (Q4)"
1615;10600153358;"Analytical Chemistry Insights";journal;"11773901";0,224;Q4;12;9;29;314;26;28;1,33;34,89;United States;"Libertas Academica";"Medical Laboratory Technology (Q3); Analytical Chemistry (Q4); Biochemistry (Q4)"
1616;21100838400;"Acta Agronomica Sinica(China)";journal;"04963490";0,223;Q3;8;139;631;4632;371;631;0,51;33,32;China;"Institute of Crop Sciences (ICS)";"Agronomy and Crop Science (Q3); Biotechnology (Q3); Plant Science (Q3)"
1617;19867;"Isokinetics and Exercise Science";journal;"09593020";0,222;Q4;22;42;122;1251;50;122;0,46;29,79;Netherlands;"IOS Press";"Orthopedics and Sports Medicine (Q3); Physical Therapy, Sports Therapy and Rehabilitation (Q3); Biophysics (Q4); Sports Science (Q4)"
1618;21100218382;"Progress on Chemistry and Application of Chitin and its Derivatives";journal;"18965644";0,222;Q4;5;22;69;409;40;69;0,53;18,59;Poland;"Polish Chitin Society";"Biochemistry (Q4); Organic Chemistry (Q4)"
